19:18:10.546698 IP 10.45.0.2.44451 > 172.217.26.238.80: Flags [S], seq 3582922701, win 65280, options [mss 1360,sackOK,TS val 3395679140 ecr 0,nop,wscale 7], length 0
19:18:10.563086 IP 172.217.26.238.80 > 10.45.0.2.44451: Flags [S.], seq 13760001, ack 3582922702, win 65535, options [mss 1460], length 0
19:18:10.565440 IP 10.45.0.2.44451 > 172.217.26.238.80: Flags [.], ack 1, win 65280, length 0
19:18:10.565708 IP 10.45.0.2.44451 > 172.217.26.238.80: Flags [P.], seq 1:75, ack 1, win 65280, length 74: HTTP: GET / HTTP/1.1
19:18:10.565876 IP 172.217.26.238.80 > 10.45.0.2.44451: Flags [.], ack 75, win 65535, length 0
19:18:10.626697 IP 172.217.26.238.80 > 10.45.0.2.44451: Flags [P.], seq 1:774, ack 75, win 65535, length 773: HTTP: HTTP/1.1 301 Moved Permanently
19:18:10.629617 IP 10.45.0.2.44451 > 172.217.26.238.80: Flags [.], ack 774, win 64507, length 0
19:18:10.632064 IP 10.45.0.2.44451 > 172.217.26.238.80: Flags [F.], seq 75, ack 774, win 64507, length 0
19:18:10.632358 IP 172.217.26.238.80 > 10.45.0.2.44451: Flags [.], ack 76, win 65535, length 0
19:18:10.649379 IP 172.217.26.238.80 > 10.45.0.2.44451: Flags [F.], seq 774, ack 76, win 65535, length 0
19:18:10.651794 IP 10.45.0.2.44451 > 172.217.26.238.80: Flags [.], ack 775, win 64507, length 0
